{"$id":"https://metriplane.local/schemas/metriplane.release-sets.v1.schema.json","$schema":"https://json-schema.org/draft/2020-12/schema","additionalProperties":false,"properties":{"owner":{"const":"MP2-041"},"projects":{"additionalProperties":{"additionalProperties":false,"properties":{"lock":{"pattern":"^(?!/)(?!.*(?:^|/)\\.\\.(?:/|$)).+\\.lock$","type":"string"},"name":{"minLength":1,"type":"string"},"path":{"pattern":"^(?:\\.|(?!/)(?!.*(?:^|/)\\.\\.(?:/|$)).+)$","type":"string"},"version_coordinate":{"additionalProperties":false,"properties":{"authority_kind":{"enum":["pyproject-static","python-attribute"]},"authority_path":{"pattern":"^(?!/)(?!.*(?:^|/)\\.\\.(?:/|$)).+$","type":"string"},"authority_pointer":{"minLength":1,"type":"string"},"cross_adapter_component_id":{"minLength":1,"type":"string"},"current_version":{"pattern":"^[0-9]+(?:\\.[0-9]+){2}(?:\\.dev[0-9]+)?$","type":"string"},"lock_package":{"minLength":1,"type":"string"}},"required":["authority_kind","authority_path","authority_pointer","current_version","lock_package"],"type":"object"}},"required":["lock","name","path","version_coordinate"],"type":"object"},"minProperties":1,"type":"object"},"python_requires":{"const":">=3.12,<3.14"},"schema_version":{"const":"metriplane.release-sets.v1"},"sets":{"additionalProperties":{"additionalProperties":false,"properties":{"extends":{"items":{"minLength":1,"type":"string"},"type":"array"},"projects":{"items":{"minLength":1,"type":"string"},"type":"array"},"purpose":{"minLength":1,"type":"string"},"root_extras":{"items":{"minLength":1,"type":"string"},"type":"array"},"variants":{"additionalProperties":{"items":{"minLength":1,"type":"string"},"minItems":1,"type":"array"},"minProperties":1,"type":"object"}},"required":["extends","projects","purpose","root_extras"],"type":"object"},"type":"object"},"historical_audit_baseline":{"additionalProperties":false,"properties":{"authority_path":{"const":"tests/adapter_conformance/registry.json"},"audited_base_commit":{"pattern":"^[0-9a-f]{40}$","type":"string"},"current_release_set_authority":{"const":false},"relationship":{"const":"historical-adapter-audit-baseline"}},"required":["authority_path","audited_base_commit","current_release_set_authority","relationship"],"type":"object"}},"required":["owner","projects","python_requires","schema_version","sets","historical_audit_baseline"],"title":"Metriplane release-set BOM registry","type":"object"}
