{"owner":"MP2-041","projects":{"maniskill-pickcube":{"lock":"adapters/maniskill_pickcube/uv.lock","name":"maniskill-pickcube-adapter","path":"adapters/maniskill_pickcube","version_coordinate":{"authority_kind":"pyproject-static","authority_path":"adapters/maniskill_pickcube/pyproject.toml","authority_pointer":"project.version","cross_adapter_component_id":"maniskill-pickcube","current_version":"1.0.0","lock_package":"maniskill-pickcube-adapter"}},"massrobotics-amr":{"lock":"adapters/massrobotics_amr/uv.lock","name":"metriplane-massrobotics-amr-adapter","path":"adapters/massrobotics_amr","version_coordinate":{"authority_kind":"pyproject-static","authority_path":"adapters/massrobotics_amr/pyproject.toml","authority_pointer":"project.version","cross_adapter_component_id":"massrobotics-amr","current_version":"1.0.0","lock_package":"metriplane-massrobotics-amr-adapter"}},"metriplane":{"lock":"uv.lock","name":"metriplane","path":".","version_coordinate":{"authority_kind":"python-attribute","authority_path":"metriplane/__init__.py","authority_pointer":"__version__","current_version":"0.5.0.dev0","lock_package":"metriplane"}},"robomimic-lowdim":{"lock":"adapters/robomimic_lowdim/uv.lock","name":"robomimic-lowdim-adapter","path":"adapters/robomimic_lowdim","version_coordinate":{"authority_kind":"pyproject-static","authority_path":"adapters/robomimic_lowdim/pyproject.toml","authority_pointer":"project.version","cross_adapter_component_id":"robomimic-lowdim","current_version":"1.0.0","lock_package":"robomimic-lowdim-adapter"}},"ros2-mcap":{"lock":"adapters/ros2_mcap/uv.lock","name":"metriplane-ros2-mcap-adapter","path":"adapters/ros2_mcap","version_coordinate":{"authority_kind":"pyproject-static","authority_path":"adapters/ros2_mcap/pyproject.toml","authority_pointer":"project.version","cross_adapter_component_id":"ros2-mcap","current_version":"1.0.0","lock_package":"metriplane-ros2-mcap-adapter"}},"source-adapter-sdk":{"lock":"adapters/source_adapter_sdk/uv.lock","name":"metriplane-source-adapter-sdk","path":"adapters/source_adapter_sdk","version_coordinate":{"authority_kind":"pyproject-static","authority_path":"adapters/source_adapter_sdk/pyproject.toml","authority_pointer":"project.version","cross_adapter_component_id":"source-adapter-sdk","current_version":"1.0.0","lock_package":"metriplane-source-adapter-sdk"}}},"python_requires":">=3.12,<3.14","schema_version":"metriplane.release-sets.v1","sets":{"adapters":{"extends":["core"],"projects":["maniskill-pickcube","massrobotics-amr","robomimic-lowdim","ros2-mcap","source-adapter-sdk"],"purpose":"All bounded external-source adapters and their shared SDK.","root_extras":[]},"analytics":{"extends":["core"],"projects":[],"purpose":"Core product plus dataframe and plotting analysis.","root_extras":["plots"]},"compat":{"extends":["adapters","analytics","connectors","live","ops","review","robotics"],"projects":[],"purpose":"Complete non-GPU compatibility surface across every packaged project.","root_extras":[]},"connectors":{"extends":["core"],"projects":[],"purpose":"Core product connector and integration surface.","root_extras":[]},"core":{"extends":[],"projects":["metriplane"],"purpose":"Default installable Metriplane product.","root_extras":[]},"full":{"extends":["compat","research"],"projects":[],"purpose":"Complete portable product family; GPU remains an explicit platform variant.","root_extras":[]},"gpu":{"extends":["core"],"projects":[],"purpose":"Linux GPU acceleration selected through exactly one CUDA variant.","root_extras":[],"variants":{"cuda12x":["gpu-cuda12x"],"cuda13x":["gpu-cuda13x"]}},"live":{"extends":["core"],"projects":[],"purpose":"Live capture and local service runtime.","root_extras":[]},"ops":{"extends":["core"],"projects":[],"purpose":"Operational validation, evidence, and recovery tooling.","root_extras":[]},"research":{"extends":["analytics","review"],"projects":[],"purpose":"Research, evaluation, and visualization surface.","root_extras":[]},"review":{"extends":["core"],"projects":[],"purpose":"Offline review, replay, and evidence inspection.","root_extras":[]},"robotics":{"extends":["adapters"],"projects":[],"purpose":"Bounded robotics source-family integration surface.","root_extras":[]}},"historical_audit_baseline":{"authority_path":"tests/adapter_conformance/registry.json","audited_base_commit":"34099903b3c3fdeb4f794edceddbf845a3f4aba8","current_release_set_authority":false,"relationship":"historical-adapter-audit-baseline"}}
